Podcast Name,Artist
Our True Crime Podcast,Our True Crime Podcast
Australian True Crime,Smart Fella
Shaun Attwood's True Crime Podcast,Shaun Attwood's True Crime Podcast
Comedy,MOHIL BANSAL
Names From The Game,Dom Finnigan
Comedy,Stand Up Spacials In Audio,Ekka feat
Comedy,Comedy Club 4 Kids Presents: Radio Nonsense,Comedy Club 4 Kids Ltd
Society and Culture,"The Creative Process · Arts, Culture & Society: Books, Film, Music, TV, Art, Writing, Education, Environment, Theatre, Dance, LGBTQ, Climate Change, Social Justice, Spirituality, Feminism, Tech, Sustainability","The Creative Process - Books, Film, Music, TV, Art, Writing, Education, Environment, Theatre, Dance, LGBTQ, Social Justice, Spirituality, Feminism, Technology..."
true crime,True Crime Daily The Podcast,True Crime Daily
true crime,Going West: True Crime,Dark West Productions
true crime,Australian True Crime,Smart Fella
true crime,The True Crime Enthusiast Podcast,The True Crime Enthusiast Podcast
true crime,True Crime Couple,True Crime Couple
